{
  "$schema": "https://raw.githubusercontent.com/Canner/WrenAI/main/wren-mdl/mdl.schema.json",
  "catalog": "ism",
  "schema": "curated",
  "dataSource": "POSTGRES",
  "models": [
    {
      "name": "DimSecurity",
      "tableReference": {
        "catalog": "ISM",
        "schema": "curated",
        "table": "dim_security"
      },
      "primaryKey": "security_no",
      "properties": {
        "description": "Security master dimension. Each row is one canonical security (stock, bond, fund, etc.). Sourced from the ISM security master or inferred via the security code bridge. The quality_tier field indicates data confidence: high = direct master match, medium = bridge-inferred, low = fallback/unknown."
      },
      "columns": [
        {
          "name": "security_no",
          "type": "varchar",
          "notNull": true,
          "properties": {
            "description": "Canonical security identifier. Primary key."
          }
        },
        {
          "name": "symbol",
          "type": "varchar",
          "properties": {
            "description": "Exchange ticker symbol (e.g. AAPL, TD). May be N/A when unknown."
          }
        },
        {
          "name": "cusip",
          "type": "varchar",
          "properties": {
            "description": "CUSIP identifier \u2014 9-character North American security identifier. May be N/A when unknown."
          }
        },
        {
          "name": "security_type",
          "type": "varchar",
          "properties": {
            "description": "High-level security type code (e.g. EQ = equity, BD = bond, MF = mutual fund, ETF). UNK when not available."
          }
        },
        {
          "name": "security_class",
          "type": "varchar",
          "properties": {
            "description": "More granular classification within the security type (e.g. common share, preferred share, government bond). UNK when not available."
          }
        },
        {
          "name": "country",
          "type": "varchar",
          "properties": {
            "description": "ISO country code of the security's primary listing (e.g. CA = Canada, US = United States). UNK when not available."
          }
        },
        {
          "name": "funds",
          "type": "varchar",
          "properties": {
            "description": "Settlement currency or fund code for this security (e.g. CAD, USD). UNK when not available."
          }
        },
        {
          "name": "english_description",
          "type": "varchar",
          "properties": {
            "description": "Full English-language description of the security (e.g. company or fund name)."
          }
        },
        {
          "name": "french_description",
          "type": "varchar",
          "properties": {
            "description": "Full French-language description of the security."
          }
        },
        {
          "name": "cad_close_price",
          "type": "double",
          "properties": {
            "description": "Most recent closing price in Canadian dollars. Null if no CAD price is available."
          }
        },
        {
          "name": "usd_close_price",
          "type": "double",
          "properties": {
            "description": "Most recent closing price in US dollars. Null if no USD price is available."
          }
        },
        {
          "name": "cad_price_date",
          "type": "date",
          "properties": {
            "description": "Date of the cad_close_price observation."
          }
        },
        {
          "name": "usd_price_date",
          "type": "date",
          "properties": {
            "description": "Date of the usd_close_price observation."
          }
        },
        {
          "name": "security_origin",
          "type": "varchar",
          "properties": {
            "description": "How this security entered the registry: 'master' = direct from ISM security master; 'bridge_fallback' = inferred from transaction security codes."
          }
        },
        {
          "name": "quality_tier",
          "type": "varchar",
          "properties": {
            "description": "Data quality confidence: 'high' = master-sourced, 'medium' = bridge-inferred, 'low' = fallback or unknown (__UNKNOWN__)."
          }
        },
        {
          "name": "curated_at",
          "type": "timestamp",
          "properties": {
            "description": "Timestamp when this row was last refreshed into the curated layer."
          }
        }
      ]
    },
    {
      "name": "Trades",
      "tableReference": {
        "catalog": "ISM",
        "schema": "curated",
        "table": "fact_trades"
      },
      "primaryKey": "trade_no",
      "properties": {
        "description": "Equity and fixed-income trade records. Each row is one trade (buy or sell order). Key columns: buy_sell (B=buy, S=sell), cancel_flag (Y=cancelled), net_amount (settlement value in account currency), net_amount_funds (currency of net_amount)."
      },
      "columns": [
        {
          "name": "trade_no",
          "type": "varchar",
          "notNull": true,
          "properties": {
            "description": "Unique trade reference number. Primary key. Synthetic format: T0000000001."
          }
        },
        {
          "name": "broker_no",
          "type": "varchar",
          "properties": {
            "description": "Executing broker identifier. Synthetic format: BXXXXXX."
          }
        },
        {
          "name": "account_no",
          "type": "varchar",
          "properties": {
            "description": "Client account identifier. Synthetic format: AXXXXXXXXXX."
          }
        },
        {
          "name": "client_no",
          "type": "varchar",
          "properties": {
            "description": "Client identifier linked to the account. Synthetic format: CLXXXXXXXX."
          }
        },
        {
          "name": "security_no",
          "type": "varchar",
          "properties": {
            "description": "Security identifier \u2014 foreign key to DimSecurity."
          }
        },
        {
          "name": "security_symbol",
          "type": "varchar",
          "properties": {
            "description": "Exchange ticker symbol of the traded security (denormalised from DimSecurity)."
          }
        },
        {
          "name": "security_cusip",
          "type": "varchar",
          "properties": {
            "description": "CUSIP of the traded security (denormalised from DimSecurity)."
          }
        },
        {
          "name": "security_type",
          "type": "varchar",
          "properties": {
            "description": "Security type code (e.g. EQ, BD, MF) \u2014 denormalised from DimSecurity."
          }
        },
        {
          "name": "security_class",
          "type": "varchar",
          "properties": {
            "description": "Security classification \u2014 denormalised from DimSecurity."
          }
        },
        {
          "name": "security_origin",
          "type": "varchar",
          "properties": {
            "description": "Security data origin: 'master' or 'bridge_fallback' \u2014 denormalised from DimSecurity."
          }
        },
        {
          "name": "security_quality_tier",
          "type": "varchar",
          "properties": {
            "description": "Security data quality: 'high', 'medium', or 'low' \u2014 denormalised from DimSecurity."
          }
        },
        {
          "name": "record_type",
          "type": "varchar",
          "properties": {
            "description": "Internal record type code classifying the transaction kind within the source system."
          }
        },
        {
          "name": "buy_sell",
          "type": "varchar",
          "properties": {
            "description": "Trade direction: 'B' = buy, 'S' = sell."
          }
        },
        {
          "name": "cancel_flag",
          "type": "varchar",
          "properties": {
            "description": "Cancellation indicator: 'Y' = this trade has been cancelled; 'N' or null = active trade."
          }
        },
        {
          "name": "process_ts",
          "type": "timestamp",
          "properties": {
            "description": "Timestamp when the trade was processed (booked) by the back office."
          }
        },
        {
          "name": "trade_ts",
          "type": "timestamp",
          "properties": {
            "description": "Timestamp when the trade was executed on the market."
          }
        },
        {
          "name": "value_ts",
          "type": "timestamp",
          "properties": {
            "description": "Settlement timestamp \u2014 when cash and securities are expected to be exchanged."
          }
        },
        {
          "name": "quantity",
          "type": "double",
          "properties": {
            "description": "Number of units (shares, bonds, fund units) traded."
          }
        },
        {
          "name": "price",
          "type": "double",
          "properties": {
            "description": "Per-unit execution price in the security's trading currency."
          }
        },
        {
          "name": "net_amount",
          "type": "double",
          "properties": {
            "description": "Total settlement amount in the account's fund currency (quantity x price +/- commissions). Use this for dollar-value aggregations."
          }
        },
        {
          "name": "net_amount_funds",
          "type": "varchar",
          "properties": {
            "description": "Currency code for net_amount (e.g. CAD, USD)."
          }
        },
        {
          "name": "account_origin",
          "type": "varchar",
          "properties": {
            "description": "How the account entered the registry: 'core.accounts' = from ISM account master; 'transaction_fallback' = inferred from transactions."
          }